"Location","Latitude","Longitude","Date","Militant Leaders Killed","militant_deaths_min","militant_deaths_max","civilian_deaths_min","civilian_deaths_max","Assumed Target","Source One","Source One link","Source Two","Source Two Link","Source Three","Source Three Link","Notes"
"Salamat Keley, Zamazola, 60km north of Wana, South Waziristan",33.02,70.08,01/16/07,"none",8,30," ",,"Al Qaeda and Taliban camp","Reuters Alertnet","http://www.alertnet.org/thenews/newsdesk/SP307520.htm","BBC","http://news.bbc.co.uk/2/hi/south_asia/6280153.stm","Washington Post","http://www.washingtonpost.com/wp-dyn/content/article/2007/01/15/AR2007011501358_pf.html","(some sources say this strike was operated by the Pakistani military; a resident told Reuters he saw a drone)"
"Danday Darpa Khel, outskirts of Miram Shah, North Waziristan",34.84,71.5,11/02/06,"none",5,5,5,5,"Madrassa founded by Jalaluddin Haqqani","BBC","http://news.bbc.co.uk/2/hi/7075026.stm","Reuters","http://www.reuters.com/article/idUSISL274440","New York Times","http://www.nytimes.com/2007/11/03/world/asia/03drone.html?pagewanted=print",
"Chenagai, six miles north of Khar, Bajaur",34.8,71.47,10/30/06,"unknown",0,80," ",,"house of a taliban commander who harbored al Qaeda fighters","BBC","http://news.bbc.co.uk/2/hi/south_asia/6097636.stm","Reuters Alertnet","http://www.alertnet.org/thenews/newsdesk/ISL72506.htm",,,
"Damadola, Bajaur",33.01,70.04,01/14/06,"none",18,18,0,,"bu Khabab al Masri (escaped); Ayman al Zawahiri (escaped)","CNN","http://www.cnn.com/2008/WORLD/asiapcf/07/29/pakistan.strike/index.html",,,,,
"Haisori, near Miram Shah, North Waziristan",32.99,70.26,11/30/05,"Abu Hamza Rabia",5,5,0,,"Abu Hamza Rabia","New York Times","http://www.nytimes.com/2005/12/04/international/asia/05cnd-qaeda.html","Christian Science Monitor",,"CNN",,
"Toorikhel, Mir Ali, North Waziristan",32.98,70.26,05/14/05,"Haitham al-Yemeni",1,1,0,,"Haitham al-Yemeni","Washington Post","http://www.washingtonpost.com/wp-dyn/articles/A60743-2005May15.html","CNN","http://www.cnn.com/2005/WORLD/asiapcf/05/13/alqaeda.killing/index.html",,,
"Wana, South Waziristan",32.99,70.24,06/18/04,"Nek Muhammad",4,4,0,,"Nek Muhammad","New York Times","http://www.nytimes.com/2004/06/19/international/asia/19STAN.html",,,,,
